{
  "version": "v0",
  "timestamp": "2026-02-09T23:52:10.938474Z",
  "data": "SGVsbG8sIEhvbG8tSUQgdjAh",
  "geometry": {
    "boundary": "icosidodecahedron",
    "coordinates": [
      [
        0.0,
        0.618033988749895,
        -1.618033988749895
      ],
      [
        1.618033988749895,
        0.0,
        -0.4120226591665967
      ],
      [
        0.0,
        1.2060113295832984,
        -0.6666666666666666
      ],
      [
        0.0,
        1.2060113295832984,
        -0.6666666666666666
      ],
      [
        1.170820393249937,
        -0.7708203932499369,
        0.32360679774997897
      ],
      [
        -1.618033988749895,
        0.3090169943749475,
        -0.3090169943749475
      ],
      [
        -0.3090169943749475,
        0.3090169943749475,
        1.618033988749895
      ],
      [
        0.0,
        0.618033988749895,
        -1.618033988749895
      ],
      [
        1.170820393249937,
        -0.7708203932499369,
        0.32360679774997897
      ],
      [
        0.0,
        1.2060113295832984,
        -0.6666666666666666
      ],
      [
        1.170820393249937,
        -0.7708203932499369,
        0.32360679774997897
      ],
      [
        -1.618033988749895,
        -0.3090169943749475,
        -0.3090169943749475
      ],
      [
        0.0,
        -0.618033988749895,
        -1.618033988749895
      ],
      [
        -0.8090169943749475,
        -0.8090169943749475,
        -1.3090169943749475
      ],
      [
        -0.3090169943749475,
        0.3090169943749475,
        1.618033988749895
      ],
      [
        1.618033988749895,
        0.0,
        0.0
      ],
      [
        -0.5,
        1.3090169943749475,
        0.5
      ],
      [
        -0.3090169943749475,
        -0.3090169943749475,
        1.618033988749895
      ]
    ]
  },
  "checksum": {
    "algorithm": "CRC32",
    "value": "884c0d32"
  }
}
